{
  "$schema": "https://json-schema.org/draft/2020-12/schema",
  "$id": "https://raw.githubusercontent.com/sesigl/open-software-factory/main/contracts/sandbox-spec/sandbox-spec.schema.json",
  "title": "SandboxSpec",
  "$comment": "Generated by `pnpm build` in contracts/ from typespec/. Do not edit.",
  "type": "object",
  "properties": {
    "template": {
      "type": "string",
      "minLength": 1,
      "description": "What the sandbox starts from: an image for the docker adapter, a SandboxTemplate for kubernetes, or a snapshot."
    },
    "cpu": {
      "type": "number",
      "minimum": 0.001,
      "description": "CPU cores. The smallest unit is 0.001 (one millicore)."
    },
    "memory": {
      "type": "string",
      "pattern": "^[0-9]+(Ki|Mi|Gi|Ti)?$",
      "description": "Kubernetes quantity, for example \"8Gi\"."
    },
    "egress": {
      "type": "array",
      "items": {
        "type": "string",
        "pattern": "^[A-Za-z0-9]([A-Za-z0-9-]*[A-Za-z0-9])?(\\.[A-Za-z0-9]([A-Za-z0-9-]*[A-Za-z0-9])?)*$",
        "description": "A hostname without scheme or port, for example \"api.linear.app\"."
      },
      "description": "Hostnames the sandbox may reach through its egress proxy. Everything else is refused."
    },
    "env": {
      "type": "object",
      "properties": {},
      "unevaluatedProperties": {
        "type": "string"
      },
      "description": "Variables of the sandbox's environment that hold no secret."
    },
    "secrets": {
      "type": "object",
      "properties": {},
      "unevaluatedProperties": {
        "type": "string",
        "pattern": "^ref:[a-z][a-z0-9-]*/[A-Za-z0-9_./-]+$",
        "description": "A reference to a secret, resolved at the egress proxy, never in the sandbox: \"ref:<provider>/<name>\"."
      },
      "description": "Secrets by the name of the variable that holds the placeholder in the sandbox. The egress proxy puts the real\nvalue in on the way out, for the hosts of `egress`."
    },
    "mcp": {
      "type": "array",
      "items": {
        "type": "object",
        "properties": {
          "name": {
            "type": "string",
            "pattern": "^[a-z][a-z0-9-]{0,62}$",
            "description": "The name in the egress log, for example \"wiki\"."
          },
          "url": {
            "type": "string",
            "pattern": "^https?://[^/]+",
            "description": "The server's endpoint, for example \"https://wiki.example.com/mcp\"."
          },
          "tools": {
            "type": "array",
            "items": {
              "type": "string"
            },
            "minItems": 1,
            "description": "The tools the sandbox may call. A call to any other tool is refused."
          }
        },
        "required": [
          "name",
          "url",
          "tools"
        ],
        "description": "An MCP server that a sandbox may call over Streamable HTTP.",
        "additionalProperties": false
      },
      "description": "The MCP servers the sandbox may call. A call to any other MCP server is refused."
    }
  },
  "required": [
    "template"
  ],
  "description": "The input of a sandbox adapter's `create` (ADR 0054): what one sandbox runs, how much it may use, and what it may\nreach. Realizes SCN-FACTORY-RUNTIME-004, -006 and -007.",
  "additionalProperties": false
}
