{
  "template": "node:24-alpine",
  "cpu": 4,
  "memory": "8Gi",
  "egress": ["api.linear.app", "registry.npmjs.org"],
  "env": { "CI": "true" },
  "secrets": { "LINEAR_TOKEN": "ref:openbao/linear-token" },
  "mcp": [{ "name": "wiki", "url": "https://wiki.example.com/mcp", "tools": ["search", "read_page"] }]
}
